{"schema":"bef_benchmark_policy_v1","policy_id":"policy_net_demo","policy_version":"1.0","tracks":[{"track_id":"demo_geom_eval_net","description":"Enable eval runs with governed network access for remote dataset fetch.","rules":{"required_public_outputs":["final_cnt"],"execution_limits":{"max_rows_total":2000000,"max_bytes_read_total":100000000,"max_access_events":500000,"max_wall_time_sec":7200},"network_access":{"enabled":true,"allowed_domains":["raw.githubusercontent.com"],"max_bytes_total":8000000,"require_tls":true}}}]}
